{
  "$schema": "https://json-schema.org/draft/2020-12/schema",
  "type": "array",
  "items": {
    "type": "object",
    "properties": {
      "slug": {
        "type": "string"
      },
      "world": {
        "type": "string"
      },
      "principle": {
        "type": "string"
      },
      "element": {
        "type": "string"
      },
      "beings": {
        "type": "string"
      }
    },
    "required": [
      "slug",
      "world",
      "principle",
      "element",
      "beings"
    ],
    "additionalProperties": false
  }
}
